{
  "$schema": "urn:umc:authorization:policy-module:1.0",
  "schemaVersion": "1.0",
  "contextSchemaVersion": "project-1.0",
  "namespace": "project",
  "policyVersion": "1.1.0",
  "moduleId": "matching-round",
  "statements": [
    {
      "id": "matching.list.member",
      "effect": "ALLOW",
      "actions": [
        "project-matching-round:list"
      ],
      "condition": {
        "type": "ALL",
        "conditions": [
          {
            "type": "PREDICATE",
            "operator": "EQ",
            "left": {
              "type": "ATTRIBUTE",
              "name": "subject.kind"
            },
            "right": {
              "type": "ENUM",
              "value": "MEMBER"
            }
          }
        ]
      },
      "outcomes": []
    },
    {
      "id": "matching.manage.super-admin",
      "effect": "ALLOW",
      "actions": [
        "project-matching-round:create",
        "project-matching-round:update",
        "project-matching-round:delete",
        "project-matching-round:human-auto-decide"
      ],
      "condition": {
        "type": "ALL",
        "conditions": [
          {
            "type": "PREDICATE",
            "operator": "EQ",
            "left": {
              "type": "ATTRIBUTE",
              "name": "subject.kind"
            },
            "right": {
              "type": "ENUM",
              "value": "MEMBER"
            }
          },
          {
            "type": "PREDICATE",
            "operator": "EQ",
            "left": {
              "type": "ATTRIBUTE",
              "name": "relation.activeSuperAdmin"
            },
            "right": {
              "type": "BOOLEAN",
              "value": true
            }
          }
        ]
      },
      "outcomes": []
    },
    {
      "id": "matching.manage.central",
      "effect": "ALLOW",
      "actions": [
        "project-matching-round:create",
        "project-matching-round:update",
        "project-matching-round:delete",
        "project-matching-round:human-auto-decide"
      ],
      "condition": {
        "type": "ALL",
        "conditions": [
          {
            "type": "PREDICATE",
            "operator": "EQ",
            "left": {
              "type": "ATTRIBUTE",
              "name": "subject.kind"
            },
            "right": {
              "type": "ENUM",
              "value": "MEMBER"
            }
          },
          {
            "type": "PREDICATE",
            "operator": "EQ",
            "left": {
              "type": "ATTRIBUTE",
              "name": "relation.activeCentralCoreInResourceGisu"
            },
            "right": {
              "type": "BOOLEAN",
              "value": true
            }
          }
        ]
      },
      "outcomes": []
    },
    {
      "id": "matching.manage.chapter",
      "effect": "ALLOW",
      "actions": [
        "project-matching-round:create",
        "project-matching-round:update",
        "project-matching-round:delete",
        "project-matching-round:human-auto-decide"
      ],
      "condition": {
        "type": "ALL",
        "conditions": [
          {
            "type": "PREDICATE",
            "operator": "EQ",
            "left": {
              "type": "ATTRIBUTE",
              "name": "subject.kind"
            },
            "right": {
              "type": "ENUM",
              "value": "MEMBER"
            }
          },
          {
            "type": "PREDICATE",
            "operator": "EQ",
            "left": {
              "type": "ATTRIBUTE",
              "name": "relation.activeChapterPresidentForResource"
            },
            "right": {
              "type": "BOOLEAN",
              "value": true
            }
          }
        ]
      },
      "outcomes": []
    },
    {
      "id": "matching.auto-decide.scheduler",
      "effect": "ALLOW",
      "actions": [
        "project-matching-round:system-auto-decide"
      ],
      "condition": {
        "type": "ALL",
        "conditions": [
          {
            "type": "PREDICATE",
            "operator": "EQ",
            "left": {
              "type": "ATTRIBUTE",
              "name": "subject.kind"
            },
            "right": {
              "type": "ENUM",
              "value": "SYSTEM"
            }
          },
          {
            "type": "PREDICATE",
            "operator": "EQ",
            "left": {
              "type": "ATTRIBUTE",
              "name": "subject.systemId"
            },
            "right": {
              "type": "STRING",
              "value": "matching-round-scheduler"
            }
          }
        ]
      },
      "outcomes": []
    }
  ]
}
