{
  "$schema": "urn:umc:authorization:policy-module:1.0",
  "schemaVersion": "1.0",
  "contextSchemaVersion": "notice-1.0",
  "namespace": "notice",
  "policyVersion": "1.0.0",
  "moduleId": "notice-resource",
  "statements": [
    {
      "id": "notice.read.active-central-core",
      "effect": "ALLOW",
      "actions": [
        "notice:read"
      ],
      "condition": {
        "type": "PREDICATE",
        "operator": "EQ",
        "left": {
          "type": "ATTRIBUTE",
          "name": "relation.activeCentralCore"
        },
        "right": {
          "type": "BOOLEAN",
          "value": true
        }
      },
      "outcomes": []
    },
    {
      "id": "notice.read.target-challenger",
      "effect": "ALLOW",
      "actions": [
        "notice:read"
      ],
      "condition": {
        "type": "PREDICATE",
        "operator": "EQ",
        "left": {
          "type": "ATTRIBUTE",
          "name": "relation.isTargetChallenger"
        },
        "right": {
          "type": "BOOLEAN",
          "value": true
        }
      },
      "outcomes": []
    },
    {
      "id": "notice.read.active-role-target",
      "effect": "ALLOW",
      "actions": [
        "notice:read"
      ],
      "condition": {
        "type": "PREDICATE",
        "operator": "EQ",
        "left": {
          "type": "ATTRIBUTE",
          "name": "relation.activeRoleCanReadTarget"
        },
        "right": {
          "type": "BOOLEAN",
          "value": true
        }
      },
      "outcomes": []
    },
    {
      "id": "notice.update-delete.author",
      "effect": "ALLOW",
      "actions": [
        "notice:update",
        "notice:delete"
      ],
      "condition": {
        "type": "PREDICATE",
        "operator": "EQ",
        "left": {
          "type": "ATTRIBUTE",
          "name": "relation.isNoticeAuthor"
        },
        "right": {
          "type": "BOOLEAN",
          "value": true
        }
      },
      "outcomes": []
    },
    {
      "id": "notice.update-delete.super-admin",
      "effect": "ALLOW",
      "actions": [
        "notice:update",
        "notice:delete"
      ],
      "condition": {
        "type": "PREDICATE",
        "operator": "EQ",
        "left": {
          "type": "ATTRIBUTE",
          "name": "relation.superAdmin"
        },
        "right": {
          "type": "BOOLEAN",
          "value": true
        }
      },
      "outcomes": []
    },
    {
      "id": "notice.recipients.active-manager",
      "effect": "ALLOW",
      "actions": [
        "notice:read-recipients",
        "notice:check-recipients"
      ],
      "condition": {
        "type": "PREDICATE",
        "operator": "EQ",
        "left": {
          "type": "ATTRIBUTE",
          "name": "relation.activeManagerForTarget"
        },
        "right": {
          "type": "BOOLEAN",
          "value": true
        }
      },
      "outcomes": []
    },
    {
      "id": "notice.create.active-target-creator",
      "effect": "ALLOW",
      "actions": [
        "notice:create"
      ],
      "condition": {
        "type": "PREDICATE",
        "operator": "EQ",
        "left": {
          "type": "ATTRIBUTE",
          "name": "relation.activeCreatorForTarget"
        },
        "right": {
          "type": "BOOLEAN",
          "value": true
        }
      },
      "outcomes": []
    }
  ]
}
