{
  "$schema": "urn:umc:authorization:policy-module:1.0",
  "schemaVersion": "1.0",
  "contextSchemaVersion": "maintenance-1.0",
  "namespace": "maintenance",
  "policyVersion": "1.0.0",
  "moduleId": "maintenance-resource",
  "statements": [
    {
      "id": "maintenance.bypass.super-admin",
      "effect": "ALLOW",
      "actions": [
        "maintenance:bypass"
      ],
      "condition": {
        "type": "PREDICATE",
        "operator": "EQ",
        "left": {
          "type": "ATTRIBUTE",
          "name": "relation.superAdmin"
        },
        "right": {
          "type": "BOOLEAN",
          "value": true
        }
      },
      "outcomes": []
    }
  ]
}
